product,title,content,date,author,rating,url
"Intel Core i3 (12th Gen) i3-12100 Quad-core (4 Core) 3.30 GHz Processor - Retail Pack, Blue",best value buck,itaaaaaas good choice price tag,"Jun, 2022",carlos rivera,5.0,https://www.amazon.com/Intel-Core-i3-12100-Quad-core-Processor/product-reviews/B09NPHJLPT/ref=cm_cr_getr_d_paging_btm_next_4?ie=UTF8&reviewerType=all_reviews&filterByStar=five_star&pageNumber=4
"Intel Core i3 (12th Gen) i3-12100 Quad-core (4 Core) 3.30 GHz Processor - Retail Pack, Blue",cheap beast,best price,"Jun, 2022",Nikita Kupriianov,5.0,https://www.amazon.com/Intel-Core-i3-12100-Quad-core-Processor/product-reviews/B09NPHJLPT/ref=cm_cr_getr_d_paging_btm_next_4?ie=UTF8&reviewerType=all_reviews&filterByStar=five_star&pageNumber=4
"Intel Core i3 (12th Gen) i3-12100 Quad-core (4 Core) 3.30 GHz Processor - Retail Pack, Blue",worked great easy install,good entry level start,"May, 2022",Shawn McEvoy,5.0,https://www.amazon.com/Intel-Core-i3-12100-Quad-core-Processor/product-reviews/B09NPHJLPT/ref=cm_cr_getr_d_paging_btm_next_4?ie=UTF8&reviewerType=all_reviews&filterByStar=five_star&pageNumber=4
"Intel Core i3 (12th Gen) i3-12100 Quad-core (4 Core) 3.30 GHz Processor - Retail Pack, Blue",count cpu,used chip entry level gaming performance blew away may fastest time writing would good luck finding core thread cpu punch weight class igpu anything special going variation save couple buck however capable cpu hard beat sub dollar price point,"Sep, 2022",M. Thompson,5.0,https://www.amazon.com/Intel-Core-i3-12100-Quad-core-Processor/product-reviews/B09NPHJLPT/ref=cm_cr_getr_d_paging_btm_next_4?ie=UTF8&reviewerType=all_reviews&filterByStar=five_star&pageNumber=4
"Intel Core i3 (12th Gen) i3-12100 Quad-core (4 Core) 3.30 GHz Processor - Retail Pack, Blue",cpu buy client care,got client want computer built would likely get check email pay bill one would probably complain long built since genso far used four build client one specific categorization,"Oct, 2022",JA.N,5.0,https://www.amazon.com/Intel-Core-i3-12100-Quad-core-Processor/product-reviews/B09NPHJLPT/ref=cm_cr_getr_d_paging_btm_next_4?ie=UTF8&reviewerType=all_reviews&filterByStar=five_star&pageNumber=4
"Intel Core i3 (12th Gen) i3-12100 Quad-core (4 Core) 3.30 GHz Processor - Retail Pack, Blue",wow,believe run well really good using gaming getting good fps,"Jul, 2023",Trey,5.0,https://www.amazon.com/Intel-Core-i3-12100-Quad-core-Processor/product-reviews/B09NPHJLPT/ref=cm_cr_getr_d_paging_btm_next_5?ie=UTF8&reviewerType=all_reviews&filterByStar=five_star&pageNumber=5
"Intel Core i3 (12th Gen) i3-12100 Quad-core (4 Core) 3.30 GHz Processor - Retail Pack, Blue",work great,installed problem thanks,"May, 2023",Ritty,5.0,https://www.amazon.com/Intel-Core-i3-12100-Quad-core-Processor/product-reviews/B09NPHJLPT/ref=cm_cr_getr_d_paging_btm_next_5?ie=UTF8&reviewerType=all_reviews&filterByStar=five_star&pageNumber=5
"Intel Core i3 (12th Gen) i3-12100 Quad-core (4 Core) 3.30 GHz Processor - Retail Pack, Blue",title,great cpu intel bust lot improvement since gen good home server,"May, 2024",Chris,5.0,https://www.amazon.com/Intel-Core-i3-12100-Quad-core-Processor/product-reviews/B09NPHJLPT/ref=cm_cr_getr_d_paging_btm_next_5?ie=UTF8&reviewerType=all_reviews&filterByStar=five_star&pageNumber=5
"Intel Core i3 (12th Gen) i3-12100 Quad-core (4 Core) 3.30 GHz Processor - Retail Pack, Blue",title,work great box super quiet cooler,"Oct, 2023",josh,5.0,https://www.amazon.com/Intel-Core-i3-12100-Quad-core-Processor/product-reviews/B09NPHJLPT/ref=cm_cr_getr_d_paging_btm_next_5?ie=UTF8&reviewerType=all_reviews&filterByStar=five_star&pageNumber=5
"Intel Core i3 (12th Gen) i3-12100 Quad-core (4 Core) 3.30 GHz Processor - Retail Pack, Blue",title,came early box damaged luckily cpu good condition used update bios board finally use gen cpu worked well motherboard videocard work pretty well expect come fan thought paired dshedit surprisingly good daily performer thought core could shaky actually performs well even game run igpu also giving acceptable result good price good balue purchasethanks seller,"Aug, 2023",Blackbind,5.0,https://www.amazon.com/Intel-Core-i3-12100-Quad-core-Processor/product-reviews/B09NPHJLPT/ref=cm_cr_getr_d_paging_btm_next_6?ie=UTF8&reviewerType=all_reviews&filterByStar=five_star&pageNumber=6
"Intel Core i3 (12th Gen) i3-12100 Quad-core (4 Core) 3.30 GHz Processor - Retail Pack, Blue",title,picked sale good priceit work great,"Jan, 2024",bruce,5.0,https://www.amazon.com/Intel-Core-i3-12100-Quad-core-Processor/product-reviews/B09NPHJLPT/ref=cm_cr_getr_d_paging_btm_next_6?ie=UTF8&reviewerType=all_reviews&filterByStar=five_star&pageNumber=6
"Intel Core i3 (12th Gen) i3-12100 Quad-core (4 Core) 3.30 GHz Processor - Retail Pack, Blue",title,strong single core decent multicore day day use like browsing office perfect good gaming spend,"Sep, 2023",takethree,5.0,https://www.amazon.com/Intel-Core-i3-12100-Quad-core-Processor/product-reviews/B09NPHJLPT/ref=cm_cr_getr_d_paging_btm_next_6?ie=UTF8&reviewerType=all_reviews&filterByStar=five_star&pageNumber=6
"Intel Core i3 (12th Gen) i3-12100 Quad-core (4 Core) 3.30 GHz Processor - Retail Pack, Blue",title,good uhd built graphic son gaming gaming rtx andgb ram motherboard good value hardly difference pricier using gtx tutorial ram son happy respective use case,"Jan, 2024",SirChan,5.0,https://www.amazon.com/Intel-Core-i3-12100-Quad-core-Processor/product-reviews/B09NPHJLPT/ref=cm_cr_getr_d_paging_btm_next_7?ie=UTF8&reviewerType=all_reviews&filterByStar=five_star&pageNumber=7
"Intel Core i3 (12th Gen) i3-12100 Quad-core (4 Core) 3.30 GHz Processor - Retail Pack, Blue",title,nvme ssd rapid onboard graphic good enough multiple display really gaming,"Jun, 2024",Nirvair Kalsi,5.0,https://www.amazon.com/Intel-Core-i3-12100-Quad-core-Processor/product-reviews/B09NPHJLPT/ref=cm_cr_getr_d_paging_btm_next_7?ie=UTF8&reviewerType=all_reviews&filterByStar=five_star&pageNumber=7
"Intel Core i3 (12th Gen) i3-12100 Quad-core (4 Core) 3.30 GHz Processor - Retail Pack, Blue",title,work intended even better thought would really good budget cpu,"Dec, 2023",Chad,5.0,https://www.amazon.com/Intel-Core-i3-12100-Quad-core-Processor/product-reviews/B09NPHJLPT/ref=cm_cr_getr_d_paging_btm_next_7?ie=UTF8&reviewerType=all_reviews&filterByStar=five_star&pageNumber=7
"Intel Core i3 (12th Gen) i3-12100 Quad-core (4 Core) 3.30 GHz Processor - Retail Pack, Blue",title,quick snappy processor budget currently built happy,"Dec, 2023",Chelsea,5.0,https://www.amazon.com/Intel-Core-i3-12100-Quad-core-Processor/product-reviews/B09NPHJLPT/ref=cm_cr_getr_d_paging_btm_next_8?ie=UTF8&reviewerType=all_reviews&filterByStar=five_star&pageNumber=8
"Intel Core i3 (12th Gen) i3-12100 Quad-core (4 Core) 3.30 GHz Processor - Retail Pack, Blue",title,even astounding much performance delivers cinebenchs singlethread test get score insane good gaming exceptionally powerful office,"Aug, 2023",Saraka,5.0,https://www.amazon.com/Intel-Core-i3-12100-Quad-core-Processor/product-reviews/B09NPHJLPT/ref=cm_cr_getr_d_paging_btm_next_8?ie=UTF8&reviewerType=all_reviews&filterByStar=five_star&pageNumber=8
"Intel Core i3 (12th Gen) i3-12100 Quad-core (4 Core) 3.30 GHz Processor - Retail Pack, Blue",title,advertised,"Feb, 2024",Kindle Customer,5.0,https://www.amazon.com/Intel-Core-i3-12100-Quad-core-Processor/product-reviews/B09NPHJLPT/ref=cm_cr_getr_d_paging_btm_next_8?ie=UTF8&reviewerType=all_reviews&filterByStar=five_star&pageNumber=8
"Intel Core i3 (12th Gen) i3-12100 Quad-core (4 Core) 3.30 GHz Processor - Retail Pack, Blue",title,processor model really performs paired intel arc model surprised ability stream gaming new world seedless ease,"Sep, 2023",Dan Benson,5.0,https://www.amazon.com/Intel-Core-i3-12100-Quad-core-Processor/product-reviews/B09NPHJLPT/ref=cm_cr_getr_d_paging_btm_next_8?ie=UTF8&reviewerType=all_reviews&filterByStar=five_star&pageNumber=8
"Intel Core i3 (12th Gen) i3-12100 Quad-core (4 Core) 3.30 GHz Processor - Retail Pack, Blue",title,luck would preparing gen system day got done building new system drastic noticeable increase speed gen part well done intel new stock cooler copper slug nicer looking shroud much appreciated temp cool low end system load idle,"Apr, 2022",Good Beard Computers,5.0,https://www.amazon.com/Intel-Core-i3-12100-Quad-core-Processor/product-reviews/B09NPHJLPT/ref=cm_cr_getr_d_paging_btm_next_8?ie=UTF8&reviewerType=all_reviews&filterByStar=five_star&pageNumber=8
"Intel Core i3 (12th Gen) i3-12100 Quad-core (4 Core) 3.30 GHz Processor - Retail Pack, Blue",title,work intended,"Apr, 2023",Alex Toth,5.0,https://www.amazon.com/Intel-Core-i3-12100-Quad-core-Processor/product-reviews/B09NPHJLPT/ref=cm_cr_getr_d_paging_btm_next_8?ie=UTF8&reviewerType=all_reviews&filterByStar=five_star&pageNumber=8
"Intel Core i3 (12th Gen) i3-12100 Quad-core (4 Core) 3.30 GHz Processor - Retail Pack, Blue",met expectation,good processor server think cheaper,"May, 2024",Roger Lodge,4.0,https://www.amazon.com/Intel-Core-i3-12100-Quad-core-Processor/product-reviews/B09NPHJLPT/ref=cm_cr_arp_d_viewopt_sr?ie=UTF8&reviewerType=all_reviews&filterByStar=four_star&pageNumber=1
"Intel Core i3 (12th Gen) i3-12100 Quad-core (4 Core) 3.30 GHz Processor - Retail Pack, Blue",fast shipping,great product really worth price,"Apr, 2024",K.L,4.0,https://www.amazon.com/Intel-Core-i3-12100-Quad-core-Processor/product-reviews/B09NPHJLPT/ref=cm_cr_arp_d_viewopt_sr?ie=UTF8&reviewerType=all_reviews&filterByStar=four_star&pageNumber=1
"Intel Core i3 (12th Gen) i3-12100 Quad-core (4 Core) 3.30 GHz Processor - Retail Pack, Blue",iris,installed asrock motherboard work great little misinformed built graphic thought bought getting iris something called uhd product description clearly say uhd bad really intel gen chip graphic processing iris many graphic processing unit sure uhd fine many thing including streaming video sure gaming though know uhd iris might saved bought version without graphic hand liked idea onboard graphic backup alternative either case run like champ compared quad core phenom based system replacingi sure relevant think mention asrock board make use board uhd graphic set bios legacy mode need use uefi mode order use board graphic sure typical board board brand asrock board need discrete graphic card use legacy bios mode boot old nonuefi installation window make sense worry,"Sep, 2023",swmagicien,4.0,https://www.amazon.com/Intel-Core-i3-12100-Quad-core-Processor/product-reviews/B09NPHJLPT/ref=cm_cr_arp_d_viewopt_sr?ie=UTF8&reviewerType=all_reviews&filterByStar=four_star&pageNumber=1
"Intel Core i3 (12th Gen) i3-12100 Quad-core (4 Core) 3.30 GHz Processor - Retail Pack, Blue",first one died month maybe warping intel replaced new chip going strong,graphic seem good enough present need better nvidia card old,"Feb, 2023",N. George,4.0,https://www.amazon.com/Intel-Core-i3-12100-Quad-core-Processor/product-reviews/B09NPHJLPT/ref=cm_cr_arp_d_viewopt_sr?ie=UTF8&reviewerType=all_reviews&filterByStar=four_star&pageNumber=1
"Intel Core i3 (12th Gen) i3-12100 Quad-core (4 Core) 3.30 GHz Processor - Retail Pack, Blue",reliable cpu supported window,cpu set nicely window,"Jun, 2022",Travis Moore,4.0,https://www.amazon.com/Intel-Core-i3-12100-Quad-core-Processor/product-reviews/B09NPHJLPT/ref=cm_cr_arp_d_viewopt_sr?ie=UTF8&reviewerType=all_reviews&filterByStar=four_star&pageNumber=1
"Intel Core i3 (12th Gen) i3-12100 Quad-core (4 Core) 3.30 GHz Processor - Retail Pack, Blue",benchmark better reality,decent proc benchmark believe better case maybe single core performance anything thread core max easily slow everything save little buy promise happier,"Sep, 2022",Josef,3.0,https://www.amazon.com/Intel-Core-i3-12100-Quad-core-Processor/product-reviews/B09NPHJLPT/ref=cm_cr_arp_d_viewopt_sr?ie=UTF8&reviewerType=all_reviews&filterByStar=three_star&pageNumber=1
"Intel Core i3 (12th Gen) i3-12100 Quad-core (4 Core) 3.30 GHz Processor - Retail Pack, Blue",title,amazing game amazing even application entirely best could faster maybe old gpu year old could speed still best could cheap guess get instead,"Nov, 2023",Tim,3.0,https://www.amazon.com/Intel-Core-i3-12100-Quad-core-Processor/product-reviews/B09NPHJLPT/ref=cm_cr_arp_d_viewopt_sr?ie=UTF8&reviewerType=all_reviews&filterByStar=three_star&pageNumber=1
Intel Core i7-13700K Gaming Desktop Processor 16 cores (8 P-cores + 8 E-cores) with Integrated Graphics - Unlocked,super fast temperature bad expected,bought replace realized much holding back bought asrock lightning board could use existing ddr ram difference night day idcooling aio cheapest could find amazon contact frame kyronaut thermal grizzly extreme paste thermal throttle cinebench unless run pass back back thrilled well cpu runsi able bump ddr mhz gear timing bios update asrock thing rock solid crazy fast get average cinebench overclock far want taken run fine thermal throttle quickly speed pretty sure could overclock beast moon threw lot money custom cooling loop plenty fast regret bumping gaming code compiling dream workload,"Mar, 2024",Robert Johnson,5.0,https://www.amazon.com/Intel-i7-13700K-Desktop-Processor-P-cores/product-reviews/B0BCF57FL5/ref=cm_cr_arp_d_viewopt_sr?ie=UTF8&reviewerType=all_reviews&filterByStar=five_star&pageNumber=1
Intel Core i7-13700K Gaming Desktop Processor 16 cores (8 P-cores + 8 E-cores) with Integrated Graphics - Unlocked,beat value,intel core gaming beast brawn bandwidth without biteoverall rating starsfor serious gamers demanding content creator overclocking enthusiast upgrading older systemsagainst pricey compared previous generation run hot requires beefy coolingperformance starsthe pack serious punch hybrid architecture performance core efficient core tackle demanding task ease whether pushing pixel latest aaa title crunching number complex spreadsheet cpu thrives pressure gaming expect silkysmooth frame beyond even demanding title compared predecessor offer noticeable performance boost especially multithreaded workloadsoverclocking starsthe overclockers dream offer plenty headroom pushing clock speed unlocking even performance potential however remember come cost increased power consumption heat generation ensure robust cooling solution like highend air cooler aio liquid cooler keep thing controlfeatures starsthe boast impressive spec pcie support nextgen hardware ddr memory compatibility intel uhd graphic basic graphic need futureproofs build ensures ready latest tech emerges however keep mind cost ddr memory might still drawback somevalue starswhile delivers fantastic performance come premium price tag compared previous generation cost per core increased however still offer compelling value compared closest competitor amd ryzen especially gaming remember need factor cost capable cooler potentially ddr memory impacting overall value propositionthings considerheat power consumption cpu run hot especially overclocking invest robust cooling solution avoid thermal throttlingprice expensive compared older generation slightly pricier main competitor consider budget carefullyddr compatibility futureproof ddr memory still expensive ddr factor overall build costfinal verdictthe intel core toptier processor serious gamers demanding content creator overclocking enthusiast blistering performance pcie ddr support overclocking headroom make futureproof powerhouse however high price heat generation ddr compatibility requirement might dealbreakers looking ultimate gaming multicore performance budget premium build worthy investment prepared feed serious watt keep coolnotethis review based research comparison benchmark result may vary depending specific hardware software configuration,"Jan, 2024",Dylin,5.0,https://www.amazon.com/Intel-i7-13700K-Desktop-Processor-P-cores/product-reviews/B0BCF57FL5/ref=cm_cr_arp_d_viewopt_sr?ie=UTF8&reviewerType=all_reviews&filterByStar=five_star&pageNumber=1
Intel Core i7-13700K Gaming Desktop Processor 16 cores (8 P-cores + 8 E-cores) with Integrated Graphics - Unlocked,quality expect intel,purchased sale best value cpu require enough speed highend gaming productivity video editingrendering streaming multitasking etc thing fast able undervolt overlock ghz pcore ghz ecores could higher wanted spend time quick overclock perfectly stable run relativelycool undervolt intel still preference cpu foresee changing especially issue read regarding amd chip boot issue crash poor multicore performance,"May, 2024",John,5.0,https://www.amazon.com/Intel-i7-13700K-Desktop-Processor-P-cores/product-reviews/B0BCF57FL5/ref=cm_cr_arp_d_viewopt_sr?ie=UTF8&reviewerType=all_reviews&filterByStar=five_star&pageNumber=1
Intel Core i7-13700K Gaming Desktop Processor 16 cores (8 P-cores + 8 E-cores) with Integrated Graphics - Unlocked,great cpu wrong,previous build year abuse decided upgrade new build disappointed great cpu handling everything throw stay cool even without fancy aio liquid cooling setup process installing cpu socket fell place perfectly adjusting motherboard arm secure cpu socket feel put bit force would thought necessary clicked place running smoothly issue highly recommendedcomplete part listmsi mag tomahawk wifi lga atx motherboard matter pack way pin pwm fan splitter thermal paste cseries classic modmesh sleeved cable kit corsair vengeance ddr ram mhz dual geforce rtx white ddrx flow dualchamber midtower corsair rgb triple pack core rmx full modular atx psu pin usb header splitter cpu cooler evo plus nvme ssd,"Dec, 2023",LovEvos,5.0,https://www.amazon.com/Intel-i7-13700K-Desktop-Processor-P-cores/product-reviews/B0BCF57FL5/ref=cm_cr_arp_d_viewopt_sr?ie=UTF8&reviewerType=all_reviews&filterByStar=five_star&pageNumber=1
Intel Core i7-13700K Gaming Desktop Processor 16 cores (8 P-cores + 8 E-cores) with Integrated Graphics - Unlocked,good cpu,team blue guy think great cpu money currently running stable,"May, 2024",C G C,5.0,https://www.amazon.com/Intel-i7-13700K-Desktop-Processor-P-cores/product-reviews/B0BCF57FL5/ref=cm_cr_arp_d_viewopt_sr?ie=UTF8&reviewerType=all_reviews&filterByStar=five_star&pageNumber=1
Intel Core i7-13700K Gaming Desktop Processor 16 cores (8 P-cores + 8 E-cores) with Integrated Graphics - Unlocked,outstanding performance utility,highest package temp cpu get running multiple application degree celsius brief moment average degree gaming high graphic game youtube running background max rated watt really fine average watt computer overall idle watt watt old gen need undervolt cpu even though giving future headache cinebench stress test get temp max degree celsius remember absolute max mode user never use cpu several minute intels extreme tuning utility automatically download installing definitely get intels website learn use easy use regret use monitoring performance use easy optimize underovervolt would recommend motherboard bios decide new bioss easier safer kind stuff anyway research use long story short want max performance play around get processor made everyone else one,"Dec, 2023",adam,5.0,https://www.amazon.com/Intel-i7-13700K-Desktop-Processor-P-cores/product-reviews/B0BCF57FL5/ref=cm_cr_arp_d_viewopt_sr?ie=UTF8&reviewerType=all_reviews&filterByStar=five_star&pageNumber=1
Intel Core i7-13700K Gaming Desktop Processor 16 cores (8 P-cores + 8 E-cores) with Integrated Graphics - Unlocked,run run hot,would opted slowercheaper version would known ran hot work probably fairly futureproof tax cool stable,"Jun, 2024",Sam B.,5.0,https://www.amazon.com/Intel-i7-13700K-Desktop-Processor-P-cores/product-reviews/B0BCF57FL5/ref=cm_cr_arp_d_viewopt_sr?ie=UTF8&reviewerType=all_reviews&filterByStar=five_star&pageNumber=1
Intel Core i7-13700K Gaming Desktop Processor 16 cores (8 P-cores + 8 E-cores) with Integrated Graphics - Unlocked,destroys whatever throw,overlocking crap liquid cooling rock solid blue screen site dedicate core appreciable decline bare metal operation temp higher cooler compared running load jump area pretty quick,"May, 2024",UltraNerd,5.0,https://www.amazon.com/Intel-i7-13700K-Desktop-Processor-P-cores/product-reviews/B0BCF57FL5/ref=cm_cr_arp_d_viewopt_sr?ie=UTF8&reviewerType=all_reviews&filterByStar=five_star&pageNumber=1
Intel Core i7-13700K Gaming Desktop Processor 16 cores (8 P-cores + 8 E-cores) with Integrated Graphics - Unlocked,great processor,good midrange processor use one year always worked well,"May, 2024",Keith A. Clay,5.0,https://www.amazon.com/Intel-i7-13700K-Desktop-Processor-P-cores/product-reviews/B0BCF57FL5/ref=cm_cr_arp_d_viewopt_sr?ie=UTF8&reviewerType=all_reviews&filterByStar=five_star&pageNumber=1
Intel Core i7-13700K Gaming Desktop Processor 16 cores (8 P-cores + 8 E-cores) with Integrated Graphics - Unlocked,best cpu upgrade ever,got cpu upgrade gen ikf processor temp slight bit toasty compared gen cpu pair real well,"Apr, 2024",Chris Roen,5.0,https://www.amazon.com/Intel-i7-13700K-Desktop-Processor-P-cores/product-reviews/B0BCF57FL5/ref=cm_cr_getr_d_paging_btm_next_2?ie=UTF8&reviewerType=all_reviews&filterByStar=five_star&pageNumber=2
Intel Core i7-13700K Gaming Desktop Processor 16 cores (8 P-cores + 8 E-cores) with Integrated Graphics - Unlocked,stable system,use every day year crucial ram kit xgb ddr desktop memory ctkgcu module corsair rmx fully modular atx power supply phanteks enthoo pro full tower chassis without window case phespcbk service one year write review part assembly easy video editing audio editing streaming wordprocessing browsing email setup use sata port even plugin esata card port drive bay filled cpu dram everything connected power supply motherboard rock solid stable case hold together work exactly way want anomaly power supply motherboard component run cool case cpu crucial ddr clocked automatically set motherboard video card modest asus geforce gddr hdmi dvi graphic card gtgcsm transitioned ancient setup mbr gpt needed able boot old system new motherboard updating window pro config gpt uefi still able boot legacy device everything worked like swiss chronograph strongly recommend cpu dram power supply case asus proart zcreator wifi lga asus video card also recommending crucial sata drive use fastest idea boot work reliably everytime far absolutely,"Nov, 2023",Buyer,5.0,https://www.amazon.com/Intel-i7-13700K-Desktop-Processor-P-cores/product-reviews/B0BCF57FL5/ref=cm_cr_getr_d_paging_btm_next_2?ie=UTF8&reviewerType=all_reviews&filterByStar=five_star&pageNumber=2
Intel Core i7-13700K Gaming Desktop Processor 16 cores (8 P-cores + 8 E-cores) with Integrated Graphics - Unlocked,great processor,iaaaaaam happy processor,"Apr, 2024",Jeremy,5.0,https://www.amazon.com/Intel-i7-13700K-Desktop-Processor-P-cores/product-reviews/B0BCF57FL5/ref=cm_cr_getr_d_paging_btm_next_2?ie=UTF8&reviewerType=all_reviews&filterByStar=five_star&pageNumber=2
Intel Core i7-13700K Gaming Desktop Processor 16 cores (8 P-cores + 8 E-cores) with Integrated Graphics - Unlocked,cpu,needed fast annoying used small rig,"Apr, 2024",Makora,5.0,https://www.amazon.com/Intel-i7-13700K-Desktop-Processor-P-cores/product-reviews/B0BCF57FL5/ref=cm_cr_getr_d_paging_btm_next_2?ie=UTF8&reviewerType=all_reviews&filterByStar=five_star&pageNumber=2
Intel Core i7-13700K Gaming Desktop Processor 16 cores (8 P-cores + 8 E-cores) with Integrated Graphics - Unlocked,huge upgrade ryzen cut visual studiodotfuscator compile time significantly,nice upgraded amd ryzen cpu component could happier everything open almost instantly whether window file explorer edge browser webpage opening file general upgraded primarily developer visual studio dotfuscator would take almost minute compile obfuscate largest program old build upgrading compiles min second longest part dotfuscator visual studio compiling compiling happens second setupmy component,"May, 2023",Juniorverse,5.0,https://www.amazon.com/Intel-i7-13700K-Desktop-Processor-P-cores/product-reviews/B0BCF57FL5/ref=cm_cr_getr_d_paging_btm_next_2?ie=UTF8&reviewerType=all_reviews&filterByStar=five_star&pageNumber=2
Intel Core i7-13700K Gaming Desktop Processor 16 cores (8 P-cores + 8 E-cores) with Integrated Graphics - Unlocked,wonderful processor,spend money get good processor regret,"Mar, 2024",Duy Nguyen,5.0,https://www.amazon.com/Intel-i7-13700K-Desktop-Processor-P-cores/product-reviews/B0BCF57FL5/ref=cm_cr_getr_d_paging_btm_next_2?ie=UTF8&reviewerType=all_reviews&filterByStar=five_star&pageNumber=2
Intel Core i7-13700K Gaming Desktop Processor 16 cores (8 P-cores + 8 E-cores) with Integrated Graphics - Unlocked,described,close give bad review found usps problem delivery possible find another shipping method avoid delay product exactly described much needed finish building thank,"Jan, 2024",Wolfgang Werner,5.0,https://www.amazon.com/Intel-i7-13700K-Desktop-Processor-P-cores/product-reviews/B0BCF57FL5/ref=cm_cr_getr_d_paging_btm_next_2?ie=UTF8&reviewerType=all_reviews&filterByStar=five_star&pageNumber=2
Intel Core i7-13700K Gaming Desktop Processor 16 cores (8 P-cores + 8 E-cores) with Integrated Graphics - Unlocked,nice,without doubt good cpu stay cool clocked run good worth money,"Feb, 2024",Todd Warren,5.0,https://www.amazon.com/Intel-i7-13700K-Desktop-Processor-P-cores/product-reviews/B0BCF57FL5/ref=cm_cr_getr_d_paging_btm_next_2?ie=UTF8&reviewerType=all_reviews&filterByStar=five_star&pageNumber=2
Intel Core i7-13700K Gaming Desktop Processor 16 cores (8 P-cores + 8 E-cores) with Integrated Graphics - Unlocked,good cpu,wanted speed without breaking bank cpu fit bill run little hot much handle aio water cooler use deepcool pleased build,"Dec, 2023",Sasha4130,5.0,https://www.amazon.com/Intel-i7-13700K-Desktop-Processor-P-cores/product-reviews/B0BCF57FL5/ref=cm_cr_getr_d_paging_btm_next_4?ie=UTF8&reviewerType=all_reviews&filterByStar=five_star&pageNumber=4
