product,title,content,date,author,rating,url
"Intel Core I5 12400F 12 Gen Generation Desktop Pc Processor 6, CPU with 18Mb Cache and Up to 4.40 Ghz Clock Speed Ddr5 and Ddr4 Ram Support Lga 1700 Socket, Micro ATX",great processor,processor power efficient develop android apps web development processor beast little gaming combination superb mhz ddr memory ssd,"Apr, 2024",ARUN,5.0,https://www.amazon.in/Intel-Generation-Desktop-Processor-Warranty/product-reviews/B09MDFH5HY/ref=cm_cr_arp_d_viewopt_sr?ie=UTF8&reviewerType=all_reviews&pageNumber=1&filterByStar=five_star
"Intel Core I5 12400F 12 Gen Generation Desktop Pc Processor 6, CPU with 18Mb Cache and Up to 4.40 Ghz Clock Speed Ddr5 and Ddr4 Ram Support Lga 1700 Socket, Micro ATX",got,try get check ranking detail section buying anything,"May, 2024",Ayush,5.0,https://www.amazon.in/Intel-Generation-Desktop-Processor-Warranty/product-reviews/B09MDFH5HY/ref=cm_cr_arp_d_viewopt_sr?ie=UTF8&reviewerType=all_reviews&pageNumber=1&filterByStar=five_star
"Intel Core I5 12400F 12 Gen Generation Desktop Pc Processor 6, CPU with 18Mb Cache and Up to 4.40 Ghz Clock Speed Ddr5 and Ddr4 Ram Support Lga 1700 Socket, Micro ATX",highest price performance processor gaming,upgrade performance gain huge use cooler master hyper cbinet intake exhaust fan temp never cross aaaac even full load stress test efficiency processor incredible run volt never reach even multi core stress testif building mid range gaming purpose cpu consider price point nothing beat processor,"Mar, 2024",Hruaia,5.0,https://www.amazon.in/Intel-Generation-Desktop-Processor-Warranty/product-reviews/B09MDFH5HY/ref=cm_cr_arp_d_viewopt_sr?ie=UTF8&reviewerType=all_reviews&pageNumber=1&filterByStar=five_star
"Intel Core I5 12400F 12 Gen Generation Desktop Pc Processor 6, CPU with 18Mb Cache and Up to 4.40 Ghz Clock Speed Ddr5 and Ddr4 Ram Support Lga 1700 Socket, Micro ATX",nice processor,best aaaaaaaa gaming multitasking processor price budget arround,"Apr, 2024",Mr.GeAr,5.0,https://www.amazon.in/Intel-Generation-Desktop-Processor-Warranty/product-reviews/B09MDFH5HY/ref=cm_cr_arp_d_viewopt_sr?ie=UTF8&reviewerType=all_reviews&pageNumber=1&filterByStar=five_star
"Intel Core I5 12400F 12 Gen Generation Desktop Pc Processor 6, CPU with 18Mb Cache and Up to 4.40 Ghz Clock Speed Ddr5 and Ddr4 Ram Support Lga 1700 Socket, Micro ATX",,run well productivity task core cpu minimum requirement smooth running large software,"Jan, 2024",Joy Mukherjee,5.0,https://www.amazon.in/Intel-Generation-Desktop-Processor-Warranty/product-reviews/B09MDFH5HY/ref=cm_cr_arp_d_viewopt_sr?ie=UTF8&reviewerType=all_reviews&pageNumber=1&filterByStar=five_star
"Intel Core I5 12400F 12 Gen Generation Desktop Pc Processor 6, CPU with 18Mb Cache and Up to 4.40 Ghz Clock Speed Ddr5 and Ddr4 Ram Support Lga 1700 Socket, Micro ATX",expected aaaaaaaa,got cheapest price sale bit worried getting scammed since processor never sold low price guess luck performance good expected aaaaaaaa,"Nov, 2023",Sagar Jadhav,5.0,https://www.amazon.in/Intel-Generation-Desktop-Processor-Warranty/product-reviews/B09MDFH5HY/ref=cm_cr_arp_d_viewopt_sr?ie=UTF8&reviewerType=all_reviews&pageNumber=1&filterByStar=five_star
"Intel Core I5 12400F 12 Gen Generation Desktop Pc Processor 6, CPU with 18Mb Cache and Up to 4.40 Ghz Clock Speed Ddr5 and Ddr4 Ram Support Lga 1700 Socket, Micro ATX",bang buck,king pricetoperformance ratiopaired game giving fps high setting,"Dec, 2023",Asad Shirazi,5.0,https://www.amazon.in/Intel-Generation-Desktop-Processor-Warranty/product-reviews/B09MDFH5HY/ref=cm_cr_arp_d_viewopt_sr?ie=UTF8&reviewerType=all_reviews&pageNumber=1&filterByStar=five_star
"Intel Core I5 12400F 12 Gen Generation Desktop Pc Processor 6, CPU with 18Mb Cache and Up to 4.40 Ghz Clock Speed Ddr5 and Ddr4 Ram Support Lga 1700 Socket, Micro ATX",great product intel,like intel processor found liked working like charm overclocking test itoverall great product,"Nov, 2023",Hari,5.0,https://www.amazon.in/Intel-Generation-Desktop-Processor-Warranty/product-reviews/B09MDFH5HY/ref=cm_cr_arp_d_viewopt_sr?ie=UTF8&reviewerType=all_reviews&pageNumber=1&filterByStar=five_star
"Intel Core I5 12400F 12 Gen Generation Desktop Pc Processor 6, CPU with 18Mb Cache and Up to 4.40 Ghz Clock Speed Ddr5 and Ddr4 Ram Support Lga 1700 Socket, Micro ATX",used processor good condition,used processor gigabyte motherboard working properly speed logical processor working properly,"Nov, 2023",dharm,5.0,https://www.amazon.in/Intel-Generation-Desktop-Processor-Warranty/product-reviews/B09MDFH5HY/ref=cm_cr_arp_d_viewopt_sr?ie=UTF8&reviewerType=all_reviews&pageNumber=1&filterByStar=five_star
"Intel Core I5 12400F 12 Gen Generation Desktop Pc Processor 6, CPU with 18Mb Cache and Up to 4.40 Ghz Clock Speed Ddr5 and Ddr4 Ram Support Lga 1700 Socket, Micro ATX",received good condition,received good condition good packing got value money beast,"Oct, 2023",Majid,5.0,https://www.amazon.in/Intel-Generation-Desktop-Processor-Warranty/product-reviews/B09MDFH5HY/ref=cm_cr_arp_d_viewopt_sr?ie=UTF8&reviewerType=all_reviews&pageNumber=1&filterByStar=five_star
"Intel Core I5 12400F 12 Gen Generation Desktop Pc Processor 6, CPU with 18Mb Cache and Up to 4.40 Ghz Clock Speed Ddr5 and Ddr4 Ram Support Lga 1700 Socket, Micro ATX",totally worth,got product good package aaaaaaaai paired cpu ram mhzif looking budget gaming excellentgaming benchmarkassassins creed unity fps high settingapex legend fps ultra settingspubg steam fps high settingsthe cpu temp aaaac max intensive gameplay hour make sure put heatsink correctly stock cooler enoughi using msi hmg motherboard stock cooler give enough room ram sticksmake sure psu least watt,"Apr, 2022",Sanket,5.0,https://www.amazon.in/Intel-Generation-Desktop-Processor-Warranty/product-reviews/B09MDFH5HY/ref=cm_cr_getr_d_paging_btm_next_2?ie=UTF8&reviewerType=all_reviews&pageNumber=2&filterByStar=five_star
"Intel Core I5 12400F 12 Gen Generation Desktop Pc Processor 6, CPU with 18Mb Cache and Up to 4.40 Ghz Clock Speed Ddr5 and Ddr4 Ram Support Lga 1700 Socket, Micro ATX",received original product,good product,"Oct, 2023",GURVINDER SINGH,5.0,https://www.amazon.in/Intel-Generation-Desktop-Processor-Warranty/product-reviews/B09MDFH5HY/ref=cm_cr_getr_d_paging_btm_next_2?ie=UTF8&reviewerType=all_reviews&pageNumber=2&filterByStar=five_star
"Intel Core I5 12400F 12 Gen Generation Desktop Pc Processor 6, CPU with 18Mb Cache and Up to 4.40 Ghz Clock Speed Ddr5 and Ddr4 Ram Support Lga 1700 Socket, Micro ATX",good,good open box,"Feb, 2023",Dhruv,5.0,https://www.amazon.in/Intel-Generation-Desktop-Processor-Warranty/product-reviews/B09MDFH5HY/ref=cm_cr_getr_d_paging_btm_next_2?ie=UTF8&reviewerType=all_reviews&pageNumber=2&filterByStar=five_star
"Intel Core I5 12400F 12 Gen Generation Desktop Pc Processor 6, CPU with 18Mb Cache and Up to 4.40 Ghz Clock Speed Ddr5 and Ddr4 Ram Support Lga 1700 Socket, Micro ATX",excellent budget gaming processor,excellent budget gaming processor value moneythe stock cooler waste better get one external cooler coolermaster corsair deepcool,"Sep, 2022",Venkat,5.0,https://www.amazon.in/Intel-Generation-Desktop-Processor-Warranty/product-reviews/B09MDFH5HY/ref=cm_cr_getr_d_paging_btm_next_2?ie=UTF8&reviewerType=all_reviews&pageNumber=2&filterByStar=five_star
"Intel Core I5 12400F 12 Gen Generation Desktop Pc Processor 6, CPU with 18Mb Cache and Up to 4.40 Ghz Clock Speed Ddr5 and Ddr4 Ram Support Lga 1700 Socket, Micro ATX",superfastalder lake processor,must buy gamers,"Sep, 2022",DHEERAJ CHAUHAN,5.0,https://www.amazon.in/Intel-Generation-Desktop-Processor-Warranty/product-reviews/B09MDFH5HY/ref=cm_cr_getr_d_paging_btm_next_2?ie=UTF8&reviewerType=all_reviews&pageNumber=2&filterByStar=five_star
"Intel Core I5 12400F 12 Gen Generation Desktop Pc Processor 6, CPU with 18Mb Cache and Up to 4.40 Ghz Clock Speed Ddr5 and Ddr4 Ram Support Lga 1700 Socket, Micro ATX",nice,using since year problem run current aaa game handle multi tasking mid high level gaming problem good combination component integrated,"Jan, 2024",Pushkar,5.0,https://www.amazon.in/Intel-Generation-Desktop-Processor-Warranty/product-reviews/B09MDFH5HY/ref=cm_cr_getr_d_paging_btm_next_2?ie=UTF8&reviewerType=all_reviews&pageNumber=2&filterByStar=five_star
"Intel Core I5 12400F 12 Gen Generation Desktop Pc Processor 6, CPU with 18Mb Cache and Up to 4.40 Ghz Clock Speed Ddr5 and Ddr4 Ram Support Lga 1700 Socket, Micro ATX",best price range,best processor price range best performance togethe,"Jul, 2022",Kunal R Kubavat,5.0,https://www.amazon.in/Intel-Generation-Desktop-Processor-Warranty/product-reviews/B09MDFH5HY/ref=cm_cr_getr_d_paging_btm_next_2?ie=UTF8&reviewerType=all_reviews&pageNumber=2&filterByStar=five_star
"Intel Core I5 12400F 12 Gen Generation Desktop Pc Processor 6, CPU with 18Mb Cache and Up to 4.40 Ghz Clock Speed Ddr5 and Ddr4 Ram Support Lga 1700 Socket, Micro ATX",best value processor,good processor build low budget computer processor install separate graphic card display would also say installing cooler liquid cooler also important processor heat,"Oct, 2022",bharat kukadiya,5.0,https://www.amazon.in/Intel-Generation-Desktop-Processor-Warranty/product-reviews/B09MDFH5HY/ref=cm_cr_getr_d_paging_btm_next_3?ie=UTF8&reviewerType=all_reviews&pageNumber=3&filterByStar=five_star
"Intel Core I5 12400F 12 Gen Generation Desktop Pc Processor 6, CPU with 18Mb Cache and Up to 4.40 Ghz Clock Speed Ddr5 and Ddr4 Ram Support Lga 1700 Socket, Micro ATX",totally worth,got product good package aaaaaaaai paired cpu ram mhzif looking budget gaming excellentgaming benchmarkassassins creed unity fps high settingapex legend fps ultra settingspubg steam fps high settingsthe cpu temp aaaac max intensive gameplay hour make sure put heatsink correctly stock cooler enoughi using msi hmg motherboard stock cooler give enough room ram sticksmake sure psu least watt,"Jul, 2022",sameer,5.0,https://www.amazon.in/Intel-Generation-Desktop-Processor-Warranty/product-reviews/B09MDFH5HY/ref=cm_cr_getr_d_paging_btm_next_3?ie=UTF8&reviewerType=all_reviews&pageNumber=3&filterByStar=five_star
"Intel Core I5 12400F 12 Gen Generation Desktop Pc Processor 6, CPU with 18Mb Cache and Up to 4.40 Ghz Clock Speed Ddr5 and Ddr4 Ram Support Lga 1700 Socket, Micro ATX",title,owned expensive cpu amd ryzen intel case overkill ran hot high wattage work offloaded everything gpu beastly cpu wastei downgraded cpu main desktop rig great productivity software music design work well gaming paired rtx series card noticed significant drop frame rate whilst gaming maybe fps game max monitor hzfps pone different thing cpu intel offering performance core thread hyperthreading low powered efficiency core really needed laptop anyway save battery powerthe cpu also efficient run quite cool mine idle light task browsing web gaming temp usually mid benchmarking cinebench geekbench etc reach mid using twofan deepcool plus air cooler three case fansall happy purchase highly recommend,"Jan, 2024",TechfanUK,5.0,https://www.amazon.in/Intel-Generation-Desktop-Processor-Warranty/product-reviews/B09MDFH5HY/ref=cm_cr_getr_d_paging_btm_next_3?ie=UTF8&reviewerType=all_reviews&pageNumber=3&filterByStar=five_star
"Intel Core I5 12400F 12 Gen Generation Desktop Pc Processor 6, CPU with 18Mb Cache and Up to 4.40 Ghz Clock Speed Ddr5 and Ddr4 Ram Support Lga 1700 Socket, Micro ATX",title,switched gen feel significant improvement especially daily task game work perfectly got ddr mhz ram well work without problem combined consumes little power get everything need done fari got noctua cooler though work really quiet cool perfect price sek cheaper version integrated graphic low profile gpus case want simple daily office use,"Apr, 2024",Mehmet Baskurt,5.0,https://www.amazon.in/Intel-Generation-Desktop-Processor-Warranty/product-reviews/B09MDFH5HY/ref=cm_cr_getr_d_paging_btm_next_3?ie=UTF8&reviewerType=all_reviews&pageNumber=3&filterByStar=five_star
"Intel Core I5 12400F 12 Gen Generation Desktop Pc Processor 6, CPU with 18Mb Cache and Up to 4.40 Ghz Clock Speed Ddr5 and Ddr4 Ram Support Lga 1700 Socket, Micro ATX",title,price performance gamingthis cpu beyond amazing see price holy moly powerhouse unbelievable price,"Aug, 2023",Chris Jeffrey,5.0,https://www.amazon.in/Intel-Generation-Desktop-Processor-Warranty/product-reviews/B09MDFH5HY/ref=cm_cr_getr_d_paging_btm_next_4?ie=UTF8&reviewerType=all_reviews&pageNumber=4&filterByStar=five_star
"Intel Core I5 12400F 12 Gen Generation Desktop Pc Processor 6, CPU with 18Mb Cache and Up to 4.40 Ghz Clock Speed Ddr5 and Ddr4 Ram Support Lga 1700 Socket, Micro ATX",title,good single thread performance core thread relatively low power suitable silent much lower price point coded cpu,"Dec, 2023",Amazon Customer,5.0,https://www.amazon.in/Intel-Generation-Desktop-Processor-Warranty/product-reviews/B09MDFH5HY/ref=cm_cr_getr_d_paging_btm_next_5?ie=UTF8&reviewerType=all_reviews&pageNumber=5&filterByStar=five_star
"Intel Core I5 12400F 12 Gen Generation Desktop Pc Processor 6, CPU with 18Mb Cache and Up to 4.40 Ghz Clock Speed Ddr5 and Ddr4 Ram Support Lga 1700 Socket, Micro ATX",title,well nuff said work star sir,"Oct, 2022",TAN T.,5.0,https://www.amazon.in/Intel-Generation-Desktop-Processor-Warranty/product-reviews/B09MDFH5HY/ref=cm_cr_getr_d_paging_btm_next_5?ie=UTF8&reviewerType=all_reviews&pageNumber=5&filterByStar=five_star
"Intel Core I5 12400F 12 Gen Generation Desktop Pc Processor 6, CPU with 18Mb Cache and Up to 4.40 Ghz Clock Speed Ddr5 and Ddr4 Ram Support Lga 1700 Socket, Micro ATX",title,really liked delivered care time important part timely delivered day like quality say itaaaaaas best hope came cooler money though cuz keeping didnaaaaaat legit spent quid hopefully,"May, 2024",Rafi Hoque,5.0,https://www.amazon.in/Intel-Generation-Desktop-Processor-Warranty/product-reviews/B09MDFH5HY/ref=cm_cr_getr_d_paging_btm_next_6?ie=UTF8&reviewerType=all_reviews&pageNumber=6&filterByStar=five_star
"Intel Core I5 12400F 12 Gen Generation Desktop Pc Processor 6, CPU with 18Mb Cache and Up to 4.40 Ghz Clock Speed Ddr5 and Ddr4 Ram Support Lga 1700 Socket, Micro ATX",title,bought new build performed great price run cool using stock cooler came withno hesitation recommending quality performance verse price,"May, 2024",Chris C.,5.0,https://www.amazon.in/Intel-Generation-Desktop-Processor-Warranty/product-reviews/B09MDFH5HY/ref=cm_cr_getr_d_paging_btm_next_6?ie=UTF8&reviewerType=all_reviews&pageNumber=6&filterByStar=five_star
"Intel Core I5 12400F 12 Gen Generation Desktop Pc Processor 6, CPU with 18Mb Cache and Up to 4.40 Ghz Clock Speed Ddr5 and Ddr4 Ram Support Lga 1700 Socket, Micro ATX",title,top processor acceptable price,"May, 2024",Alen,5.0,https://www.amazon.in/Intel-Generation-Desktop-Processor-Warranty/product-reviews/B09MDFH5HY/ref=cm_cr_getr_d_paging_btm_next_7?ie=UTF8&reviewerType=all_reviews&pageNumber=7&filterByStar=five_star
"Intel Core I5 12400F 12 Gen Generation Desktop Pc Processor 6, CPU with 18Mb Cache and Up to 4.40 Ghz Clock Speed Ddr5 and Ddr4 Ram Support Lga 1700 Socket, Micro ATX",title,going top end build review iaaaaaad read seemed like best option easy instal came cooling fan although chose use bigger air cooler,"Dec, 2023",Marc,5.0,https://www.amazon.in/Intel-Generation-Desktop-Processor-Warranty/product-reviews/B09MDFH5HY/ref=cm_cr_getr_d_paging_btm_next_7?ie=UTF8&reviewerType=all_reviews&pageNumber=7&filterByStar=five_star
"Intel Core I5 12400F 12 Gen Generation Desktop Pc Processor 6, CPU with 18Mb Cache and Up to 4.40 Ghz Clock Speed Ddr5 and Ddr4 Ram Support Lga 1700 Socket, Micro ATX",title,gamer like keep reasonably date intel cpu fit bill fast work well motherboard reasonably priced cooler provided need well get bit noisy cpu remains high time overall happy processor,"Apr, 2023",R. Hope,5.0,https://www.amazon.in/Intel-Generation-Desktop-Processor-Warranty/product-reviews/B09MDFH5HY/ref=cm_cr_getr_d_paging_btm_next_7?ie=UTF8&reviewerType=all_reviews&pageNumber=7&filterByStar=five_star
"Intel Core I5 12400F 12 Gen Generation Desktop Pc Processor 6, CPU with 18Mb Cache and Up to 4.40 Ghz Clock Speed Ddr5 and Ddr4 Ram Support Lga 1700 Socket, Micro ATX",title,top,"May, 2024",sarah baudin,5.0,https://www.amazon.in/Intel-Generation-Desktop-Processor-Warranty/product-reviews/B09MDFH5HY/ref=cm_cr_getr_d_paging_btm_next_8?ie=UTF8&reviewerType=all_reviews&pageNumber=8&filterByStar=five_star
"Intel Core I5 12400F 12 Gen Generation Desktop Pc Processor 6, CPU with 18Mb Cache and Up to 4.40 Ghz Clock Speed Ddr5 and Ddr4 Ram Support Lga 1700 Socket, Micro ATX",discrete graphic processor,work without graphic card careful ordering,"Feb, 2024",Yavvari,4.0,https://www.amazon.in/Intel-Generation-Desktop-Processor-Warranty/product-reviews/B09MDFH5HY/ref=cm_cr_arp_d_viewopt_sr?ie=UTF8&reviewerType=all_reviews&pageNumber=1&filterByStar=four_star
"Intel Core I5 12400F 12 Gen Generation Desktop Pc Processor 6, CPU with 18Mb Cache and Up to 4.40 Ghz Clock Speed Ddr5 and Ddr4 Ram Support Lga 1700 Socket, Micro ATX",keep mind definitely buy graphic card,one graphic processing unit hence use without graphic card bios bootother excellent processor,"Nov, 2023",Vijay David,4.0,https://www.amazon.in/Intel-Generation-Desktop-Processor-Warranty/product-reviews/B09MDFH5HY/ref=cm_cr_arp_d_viewopt_sr?ie=UTF8&reviewerType=all_reviews&pageNumber=1&filterByStar=four_star
"Intel Core I5 12400F 12 Gen Generation Desktop Pc Processor 6, CPU with 18Mb Cache and Up to 4.40 Ghz Clock Speed Ddr5 and Ddr4 Ram Support Lga 1700 Socket, Micro ATX",good processor,installing window giving following description processorth gen intelr coretm ghzit requires graphic card,"Jul, 2023",pallabg,4.0,https://www.amazon.in/Intel-Generation-Desktop-Processor-Warranty/product-reviews/B09MDFH5HY/ref=cm_cr_arp_d_viewopt_sr?ie=UTF8&reviewerType=all_reviews&pageNumber=1&filterByStar=four_star
"Intel Core I5 12400F 12 Gen Generation Desktop Pc Processor 6, CPU with 18Mb Cache and Up to 4.40 Ghz Clock Speed Ddr5 and Ddr4 Ram Support Lga 1700 Socket, Micro ATX",great process pathetic stock cooler,cpu overall great everything itaaaaaall give flaw performance mediocre level video editing hardcore level gaming streaming looking buy gaming perfect buy thing disappointing stock cooler first would like request intel please stop making clip cooler unreliable annoying sometimes fit sometimes doesnaaaaaat also clip fragile might break one someday trying fit provide simple screw bolt cooler proper mounting also performance nice many would say stock cooler enough case rendering video cpu temp touched degree took cooler reinstalled ensure proper installation still going degree approx case gaming know maybe cooler clip faulty cooler able mount properly cooling careful stock cooler would suggest buy market cpu cooler aio especially live somewhere like india get degree easily donaaaaaat room aio choice,"Apr, 2022",Divyansh singh Jadav,4.0,https://www.amazon.in/Intel-Generation-Desktop-Processor-Warranty/product-reviews/B09MDFH5HY/ref=cm_cr_arp_d_viewopt_sr?ie=UTF8&reviewerType=all_reviews&pageNumber=1&filterByStar=four_star
"Intel Core I5 12400F 12 Gen Generation Desktop Pc Processor 6, CPU with 18Mb Cache and Up to 4.40 Ghz Clock Speed Ddr5 and Ddr4 Ram Support Lga 1700 Socket, Micro ATX",title,would useful specify board work plug play longer exist,"May, 2024",E.M.Ireland,4.0,https://www.amazon.in/Intel-Generation-Desktop-Processor-Warranty/product-reviews/B09MDFH5HY/ref=cm_cr_arp_d_viewopt_sr?ie=UTF8&reviewerType=all_reviews&pageNumber=1&filterByStar=four_star
"Intel Core I5 12400F 12 Gen Generation Desktop Pc Processor 6, CPU with 18Mb Cache and Up to 4.40 Ghz Clock Speed Ddr5 and Ddr4 Ram Support Lga 1700 Socket, Micro ATX",title,great trying make midrange could spent little get,"May, 2023",Shrek,4.0,https://www.amazon.in/Intel-Generation-Desktop-Processor-Warranty/product-reviews/B09MDFH5HY/ref=cm_cr_arp_d_viewopt_sr?ie=UTF8&reviewerType=all_reviews&pageNumber=1&filterByStar=four_star
"Intel Core I5 12400F 12 Gen Generation Desktop Pc Processor 6, CPU with 18Mb Cache and Up to 4.40 Ghz Clock Speed Ddr5 and Ddr4 Ram Support Lga 1700 Socket, Micro ATX",title,love cpu price tag handle newest game well work quite well graphic design application issue ram locked maximum mhz want get higher consider,"Aug, 2023",Smile,4.0,https://www.amazon.in/Intel-Generation-Desktop-Processor-Warranty/product-reviews/B09MDFH5HY/ref=cm_cr_arp_d_viewopt_sr?ie=UTF8&reviewerType=all_reviews&pageNumber=1&filterByStar=four_star
"Intel Core I5 12400F 12 Gen Generation Desktop Pc Processor 6, CPU with 18Mb Cache and Up to 4.40 Ghz Clock Speed Ddr5 and Ddr4 Ram Support Lga 1700 Socket, Micro ATX",title,top,"Jul, 2023",Franck.Standing,4.0,https://www.amazon.in/Intel-Generation-Desktop-Processor-Warranty/product-reviews/B09MDFH5HY/ref=cm_cr_getr_d_paging_btm_next_4?ie=UTF8&reviewerType=all_reviews&pageNumber=4&filterByStar=four_star
"Intel Core I5 12400F 12 Gen Generation Desktop Pc Processor 6, CPU with 18Mb Cache and Up to 4.40 Ghz Clock Speed Ddr5 and Ddr4 Ram Support Lga 1700 Socket, Micro ATX",title,cpu money stock cooler problem getting loud normal temp sound like engine,"Jan, 2023",vlad,4.0,https://www.amazon.in/Intel-Generation-Desktop-Processor-Warranty/product-reviews/B09MDFH5HY/ref=cm_cr_getr_d_paging_btm_next_5?ie=UTF8&reviewerType=all_reviews&pageNumber=5&filterByStar=four_star
"Intel Core I5 12400F 12 Gen Generation Desktop Pc Processor 6, CPU with 18Mb Cache and Up to 4.40 Ghz Clock Speed Ddr5 and Ddr4 Ram Support Lga 1700 Socket, Micro ATX",overprice try buy,caution price overprice please buy otherwise check applicationssites better price,"Jul, 2022",Jayendra Bariya,3.0,https://www.amazon.in/Intel-Generation-Desktop-Processor-Warranty/product-reviews/B09MDFH5HY/ref=cm_cr_arp_d_viewopt_sr?ie=UTF8&reviewerType=all_reviews&pageNumber=1&filterByStar=three_star
"Intel Core I5 12400F 12 Gen Generation Desktop Pc Processor 6, CPU with 18Mb Cache and Up to 4.40 Ghz Clock Speed Ddr5 and Ddr4 Ram Support Lga 1700 Socket, Micro ATX",title,whataaaaaas noise itaaaaaas broken cooler fan blade intel must missed oneaaaaaa shame,"Jun, 2023",FlyingzucchiniAU,3.0,https://www.amazon.in/Intel-Generation-Desktop-Processor-Warranty/product-reviews/B09MDFH5HY/ref=cm_cr_arp_d_viewopt_sr?ie=UTF8&reviewerType=all_reviews&pageNumber=1&filterByStar=three_star
"Intel Core I5 12400F 12 Gen Generation Desktop Pc Processor 6, CPU with 18Mb Cache and Up to 4.40 Ghz Clock Speed Ddr5 and Ddr4 Ram Support Lga 1700 Socket, Micro ATX",title,pretty powerful modern intel processor bought replacing gaming pcon front intel agree friend fact powerful enough processor form gaming easy installhowever use stock cooler come thingif want run average game halo etc find strong enough handle without breaking sweathowever intending video photo editing god forbid emulation find loudest ineffective fan ever misfortune witnessingwhen fast forward game pcsx reach previous computer stock cooler would keep locked circumstancesi would tell hot got trying run rpcs immediately went task manager close application saw hit ctldr intend use processor true capability use cooler come itextremely disappointing kicking researching thoroughly erroneously thought past experience could handle basic task without sounding like helicopter taking,"May, 2024",Xavier Levin,3.0,https://www.amazon.in/Intel-Generation-Desktop-Processor-Warranty/product-reviews/B09MDFH5HY/ref=cm_cr_arp_d_viewopt_sr?ie=UTF8&reviewerType=all_reviews&pageNumber=1&filterByStar=three_star
"Intel Core I5 12400F 12 Gen Generation Desktop Pc Processor 6, CPU with 18Mb Cache and Up to 4.40 Ghz Clock Speed Ddr5 and Ddr4 Ram Support Lga 1700 Socket, Micro ATX",title,cpu perfect amazing going lie work expected even higher fortnite went fps fps really shocked big jump amazing good cpu really happy reason give start due arrived house unboxed prepeller cpu fan broken tried contacting coulnt fix issue live part fan missing due make alot sound speed buy fan septuratly happy end good cpu general leave read review lol unlucky cpu really good trust,"May, 2024",Zain,3.0,https://www.amazon.in/Intel-Generation-Desktop-Processor-Warranty/product-reviews/B09MDFH5HY/ref=cm_cr_arp_d_viewopt_sr?ie=UTF8&reviewerType=all_reviews&pageNumber=1&filterByStar=three_star
"Intel Core I5 12400F 12 Gen Generation Desktop Pc Processor 6, CPU with 18Mb Cache and Up to 4.40 Ghz Clock Speed Ddr5 and Ddr4 Ram Support Lga 1700 Socket, Micro ATX",title,top,"Oct, 2023",Nils,3.0,https://www.amazon.in/Intel-Generation-Desktop-Processor-Warranty/product-reviews/B09MDFH5HY/ref=cm_cr_arp_d_viewopt_sr?ie=UTF8&reviewerType=all_reviews&pageNumber=1&filterByStar=three_star
"Intel Core I5 12400F 12 Gen Generation Desktop Pc Processor 6, CPU with 18Mb Cache and Up to 4.40 Ghz Clock Speed Ddr5 and Ddr4 Ram Support Lga 1700 Socket, Micro ATX",disappointing experience defective processor,recently purchased processor amazon unfortunately turned defective despite effort seek assistance amazon customer support proved unhelpful leaving frustrated hardearned money seemingly drain disappointed product lack support advise potential buyer exercise caution considering purchase,"Dec, 2023",aarti,1.0,https://www.amazon.in/Intel-Generation-Desktop-Processor-Warranty/product-reviews/B09MDFH5HY/ref=cm_cr_arp_d_viewopt_sr?ie=UTF8&reviewerType=all_reviews&pageNumber=1&filterByStar=one_star
"Intel Core I5 12400F 12 Gen Generation Desktop Pc Processor 6, CPU with 18Mb Cache and Up to 4.40 Ghz Clock Speed Ddr5 and Ddr4 Ram Support Lga 1700 Socket, Micro ATX",received used product,donaaaaaat buy thereaaaaaare selling used defective product,"Jan, 2024",GaurSahab,1.0,https://www.amazon.in/Intel-Generation-Desktop-Processor-Warranty/product-reviews/B09MDFH5HY/ref=cm_cr_arp_d_viewopt_sr?ie=UTF8&reviewerType=all_reviews&pageNumber=1&filterByStar=one_star
