product,title,content,date,author,rating,url
Intel Core i7-3930K 3.2GHz Six Core (CM8061901100802) Processor,cheap powerful,paid euro cpu ocd ghz volt paired ocd run everything like dream even crossifre config streamer decent mobos buy enjoy cheap powerful experience went core xeon better single core perf overclockability clear winner cinebench also show,"Jan, 2018",GLiDBLcuQ4O@Del...,5 out of 5 stars,https://www.ebay.com/urw/Intel-Core-i7-3930K-3-2GHz-Six-Core-CM8061901100802-Processor/product-reviews/115945396
Intel Core i7-3930K 3.2GHz Six Core (CM8061901100802) Processor,still strong stable ghz,put cpu asrock fatality pro motherboardit nice see ghz still easy get old wiser cpu,"Jun, 2017",J9GTxm8-RAi@Del...,4 out of 5 stars,https://www.ebay.com/urw/Intel-Core-i7-3930K-3-2GHz-Six-Core-CM8061901100802-Processor/product-reviews/115945396
Intel Core i7-3930K 3.2GHz Six Core (CM8061901100802) Processor,fast reliable,bought processor motherboard intel extreme dxsri like everything processor fast overheat good parameter core cache memoryif compared processor core work faster heavy applicationsrecommended gamers clockers,"May, 2015",kimani124,5 out of 5 stars,https://www.ebay.com/urw/Intel-Core-i7-3930K-3-2GHz-Six-Core-CM8061901100802-Processor/product-reviews/115945396
Intel Core i7-3930K 3.2GHz Six Core (CM8061901100802) Processor,chip work,thermal paste bad inbetween ihs run noctua resolve later price,"Jun, 2022",schefflerkyle1234,3 out of 5 stars,https://www.ebay.com/urw/Intel-Core-i7-3930K-3-2GHz-Six-Core-CM8061901100802-Processor/product-reviews/115945396
Intel Core i7-3930K 3.2GHz Six Core (CM8061901100802) Processor,worked great,worked great,"May, 2024",kpopn_83,5 out of 5 stars,https://www.ebay.com/urw/Intel-Core-i7-3930K-3-2GHz-Six-Core-CM8061901100802-Processor/product-reviews/115945396
"Intel Core I7 7700 Processor (3.60 GHz, 4 Cores, FCLGA1151) - SR338",great processor business,benchmark excellent core thread great machine,"May, 2023",whitelionshop,5 out of 5 stars,https://www.ebay.com/urw/Intel-Core-I7-7700-Processor-3-60-GHz-4-Cores-FCLGA1151-SR338/product-reviews/4045596692
"Intel Core I7 7700 Processor (3.60 GHz, 4 Cores, FCLGA1151) - SR338",intel processor,worked expected machine went issue good,"Mar, 2023",sammi-g6090,5 out of 5 stars,https://www.ebay.com/urw/Intel-Core-I7-7700-Processor-3-60-GHz-4-Cores-FCLGA1151-SR338/product-reviews/4045596692
"Intel Core I7 7700 Processor (3.60 GHz, 4 Cores, FCLGA1151) - SR338",excellent processor priceperformance,good processor price support older ddr need overclocking,"Nov, 2022",kn3049.obskifyh,5 out of 5 stars,https://www.ebay.com/urw/Intel-Core-I7-7700-Processor-3-60-GHz-4-Cores-FCLGA1151-SR338/product-reviews/4045596692
"Intel Core I7 7700 Processor (3.60 GHz, 4 Cores, FCLGA1151) - SR338",upgrade processor,price great made test machine much faster,"Oct, 2023",thepcmanager,5 out of 5 stars,https://www.ebay.com/urw/Intel-Core-I7-7700-Processor-3-60-GHz-4-Cores-FCLGA1151-SR338/product-reviews/4045596692
"Intel Core I7 7700 Processor (3.60 GHz, 4 Cores, FCLGA1151) - SR338",well worth money spent,cheap far experiencing lag game limited cpu installing difficult old computer inexperienced,"Jun, 2022",treab_57,5 out of 5 stars,https://www.ebay.com/urw/Intel-Core-I7-7700-Processor-3-60-GHz-4-Cores-FCLGA1151-SR338/product-reviews/4045596692
"Intel Core I7 7700 Processor (3.60 GHz, 4 Cores, FCLGA1151) - SR338",excellent ebayer,product described listing work well easy installation,"May, 2023",kg8dv,5 out of 5 stars,https://www.ebay.com/urw/Intel-Core-I7-7700-Processor-3-60-GHz-4-Cores-FCLGA1151-SR338/product-reviews/4045596692
"Intel Core I7 7700 Processor (3.60 GHz, 4 Cores, FCLGA1151) - SR338",nice upgrade,installed minute worked right away,"May, 2021",mikegeek,5 out of 5 stars,https://www.ebay.com/urw/Intel-Core-I7-7700-Processor-3-60-GHz-4-Cores-FCLGA1151-SR338/product-reviews/4045596692
"Intel Core I7 7700 Processor (3.60 GHz, 4 Cores, FCLGA1151) - SR338",item arrived early clean well packed tested worked expected thanks,item arrived early clean well packed tested worked expected thanks,"Jun, 2024",phlogiston00,4 out of 5 stars,https://www.ebay.com/urw/Intel-Core-I7-7700-Processor-3-60-GHz-4-Cores-FCLGA1151-SR338/product-reviews/4045596692
"Intel Core I7 7700 Processor (3.60 GHz, 4 Cores, FCLGA1151) - SR338",great upgrade,easy upgrade motherboard going,"Jan, 2024",charlie25927,5 out of 5 stars,https://www.ebay.com/urw/Intel-Core-I7-7700-Processor-3-60-GHz-4-Cores-FCLGA1151-SR338/product-reviews/4045596692
"Intel Core I7 7700 Processor (3.60 GHz, 4 Cores, FCLGA1151) - SR338",work fine,took awhile receive canada cpu packaging good,"Jun, 2023",fankamen-0,5 out of 5 stars,https://www.ebay.com/urw/Intel-Core-I7-7700-Processor-3-60-GHz-4-Cores-FCLGA1151-SR338/product-reviews/4045596692
"Intel Core I7 7700 Processor (3.60 GHz, 4 Cores, FCLGA1151) - SR338",good product,good performance,"Sep, 2023",ca_solod,5 out of 5 stars,https://www.ebay.com/urw/Intel-Core-I7-7700-Processor-3-60-GHz-4-Cores-FCLGA1151-SR338/product-reviews/4045596692?pgn=2
"Intel Core I7 7700 Processor (3.60 GHz, 4 Cores, FCLGA1151) - SR338",work great described thanks,work great described thanks,"May, 2024",techchamp,5 out of 5 stars,https://www.ebay.com/urw/Intel-Core-I7-7700-Processor-3-60-GHz-4-Cores-FCLGA1151-SR338/product-reviews/4045596692?pgn=2
"Intel Core I7 7700 Processor (3.60 GHz, 4 Cores, FCLGA1151) - SR338",thank work great,thank work great,"May, 2024",bandwagon69ryan,5 out of 5 stars,https://www.ebay.com/urw/Intel-Core-I7-7700-Processor-3-60-GHz-4-Cores-FCLGA1151-SR338/product-reviews/4045596692?pgn=2
"Intel Core I7 7700 Processor (3.60 GHz, 4 Cores, FCLGA1151) - SR338",worked great,worked great,"May, 2024",jonivxx2000,5 out of 5 stars,https://www.ebay.com/urw/Intel-Core-I7-7700-Processor-3-60-GHz-4-Cores-FCLGA1151-SR338/product-reviews/4045596692?pgn=2
"Intel Core I7 7700 Processor (3.60 GHz, 4 Cores, FCLGA1151) - SR338",get job done,best cpu system could buy,"Nov, 2023",mshefflr,5 out of 5 stars,https://www.ebay.com/urw/Intel-Core-I7-7700-Processor-3-60-GHz-4-Cores-FCLGA1151-SR338/product-reviews/4045596692?pgn=2
"Intel Core I7 7700 Processor (3.60 GHz, 4 Cores, FCLGA1151) - SR338",good quality price,good quality price,"Sep, 2021",heat462,5 out of 5 stars,https://www.ebay.com/urw/Intel-Core-I7-7700-Processor-3-60-GHz-4-Cores-FCLGA1151-SR338/product-reviews/4045596692?pgn=2
"Intel Core I7 7700 Processor (3.60 GHz, 4 Cores, FCLGA1151) - SR338",work,thank much,"Jun, 2022",enrique10_0,5 out of 5 stars,https://www.ebay.com/urw/Intel-Core-I7-7700-Processor-3-60-GHz-4-Cores-FCLGA1151-SR338/product-reviews/4045596692?pgn=2
"Intel Core i7-8700 Processor (3.2 GHz, 6 Cores, LGA 1151) - SR3QS",excellent processor,since processor continues reliable performs remarkably well older even processor still push decent performance game future proof many year come paired right powerful video card according userbenchmark today nonk ranked cpu world ranked,"Jul, 2021",idyllistic,5 out of 5 stars,https://www.ebay.com/urw/Intel-Core-i7-8700-Processor-3-2-GHz-6-Cores-LGA-1151-SR3QS/product-reviews/15029958194
"Intel Core i7-8700 Processor (3.2 GHz, 6 Cores, LGA 1151) - SR3QS",excellent processor,exactly wanted took gaming machine izero hero,"Jul, 2023",dennisblad,5 out of 5 stars,https://www.ebay.com/urw/Intel-Core-i7-8700-Processor-3-2-GHz-6-Cores-LGA-1151-SR3QS/product-reviews/15029958194
"Intel Core i7-8700 Processor (3.2 GHz, 6 Cores, LGA 1151) - SR3QS",way faster,replaced asus dsc extremely pleased product,"Jan, 2021",jaribh,5 out of 5 stars,https://www.ebay.com/urw/Intel-Core-i7-8700-Processor-3-2-GHz-6-Cores-LGA-1151-SR3QS/product-reviews/15029958194
"Intel Core i7-8700 Processor (3.2 GHz, 6 Cores, LGA 1151) - SR3QS",great processor,work supposed,"Jul, 2023",bw4453972,5 out of 5 stars,https://www.ebay.com/urw/Intel-Core-i7-8700-Processor-3-2-GHz-6-Cores-LGA-1151-SR3QS/product-reviews/15029958194
"Intel Core i7-8700 Processor (3.2 GHz, 6 Cores, LGA 1151) - SR3QS",,really good cpu money work great gaming need,"Dec, 2022",evol_18,5 out of 5 stars,https://www.ebay.com/urw/Intel-Core-i7-8700-Processor-3-2-GHz-6-Cores-LGA-1151-SR3QS/product-reviews/15029958194
"Intel Core i7-8700 Processor (3.2 GHz, 6 Cores, LGA 1151) - SR3QS",processor medium server,processor perfect task work medium server,"Jun, 2021",ghenn_golme,5 out of 5 stars,https://www.ebay.com/urw/Intel-Core-i7-8700-Processor-3-2-GHz-6-Cores-LGA-1151-SR3QS/product-reviews/15029958194
"Intel Core i7-8700 Processor (3.2 GHz, 6 Cores, LGA 1151) - SR3QS",fast shipping good communication cpu look work great packaging much esd awareness unless antistatic paper towel wrapped,fast shipping good communication cpu look work greatpackaging much esd awareness unless antistatic paper towelit wrapped argue functionality cpu work fine margin,"May, 2024",91redescort,5 out of 5 stars,https://www.ebay.com/urw/Intel-Core-i7-8700-Processor-3-2-GHz-6-Cores-LGA-1151-SR3QS/product-reviews/15029958194
"Intel Core i7-8700 Processor (3.2 GHz, 6 Cores, LGA 1151) - SR3QS",work,fast shipping work,"Nov, 2019",los2010,4 out of 5 stars,https://www.ebay.com/urw/Intel-Core-i7-8700-Processor-3-2-GHz-6-Cores-LGA-1151-SR3QS/product-reviews/15029958194
"Intel Core i7-8700 Processor (3.2 GHz, 6 Cores, LGA 1151) - SR3QS",good purchase,function spec came reasonable price,"Apr, 2023",lazlopup1,4 out of 5 stars,https://www.ebay.com/urw/Intel-Core-i7-8700-Processor-3-2-GHz-6-Cores-LGA-1151-SR3QS/product-reviews/15029958194
"Intel Core i7-8700 Processor (3.2 GHz, 6 Cores, LGA 1151) - SR3QS",powerful cpu,work well still powerful cpu,"Mar, 2024",montreal_shop,4 out of 5 stars,https://www.ebay.com/urw/Intel-Core-i7-8700-Processor-3-2-GHz-6-Cores-LGA-1151-SR3QS/product-reviews/15029958194
"Intel Core i7-8700 Processor (3.2 GHz, 6 Cores, LGA 1151) - SR3QS",work well expected,work well expected,"Jun, 2024",chromatidx,5 out of 5 stars,https://www.ebay.com/urw/Intel-Core-i7-8700-Processor-3-2-GHz-6-Cores-LGA-1151-SR3QS/product-reviews/15029958194?pgn=2
"Intel Core i7-8700 Processor (3.2 GHz, 6 Cores, LGA 1151) - SR3QS",,great product work well,"Dec, 2022",philichur_0,5 out of 5 stars,https://www.ebay.com/urw/Intel-Core-i7-8700-Processor-3-2-GHz-6-Cores-LGA-1151-SR3QS/product-reviews/15029958194?pgn=2
"Intel Core i7-8700 Processor (3.2 GHz, 6 Cores, LGA 1151) - SR3QS",used cpu,product work,"May, 2022",wchan3,4 out of 5 stars,https://www.ebay.com/urw/Intel-Core-i7-8700-Processor-3-2-GHz-6-Cores-LGA-1151-SR3QS/product-reviews/15029958194?pgn=2
"Intel Core i7-8700 Processor (3.2 GHz, 6 Cores, LGA 1151) - SR3QS",running hot need better cooling,running hot need better cooling,"May, 2024",emissary*123,5 out of 5 stars,https://www.ebay.com/urw/Intel-Core-i7-8700-Processor-3-2-GHz-6-Cores-LGA-1151-SR3QS/product-reviews/15029958194?pgn=2
"Intel Core i7-8700 Processor (3.2 GHz, 6 Cores, LGA 1151) - SR3QS",,perfect,"Jul, 2021",jtb0863,5 out of 5 stars,https://www.ebay.com/urw/Intel-Core-i7-8700-Processor-3-2-GHz-6-Cores-LGA-1151-SR3QS/product-reviews/15029958194?pgn=2
Intel Core i3-4130 3.4GHz Dual-Core SR1NP CPU Processor,new life old workhorse practically new machine running window like champ,new life old workhorse practically new machine running window like champ,"Jun, 2024",amavinnie,5 out of 5 stars,https://www.ebay.com/urw/Intel-Core-i3-4130-3-4GHz-Dual-Core-SR1NP-CPU-Processor/product-reviews/20066941741
Intel Core i3-4130 3.4GHz Dual-Core SR1NP CPU Processor,great upgrade aging lga motherboard brings new life,great upgrade aging lga motherboard brings new life,"May, 2024",mrmylesg,5 out of 5 stars,https://www.ebay.com/urw/Intel-Core-i3-4130-3-4GHz-Dual-Core-SR1NP-CPU-Processor/product-reviews/20066941741
Intel Core i3-4130 3.4GHz Dual-Core SR1NP CPU Processor,work great thanks,work great thanks,"May, 2024",robertm2218,5 out of 5 stars,https://www.ebay.com/urw/Intel-Core-i3-4130-3-4GHz-Dual-Core-SR1NP-CPU-Processor/product-reviews/20066941741
Intel Core i3-4130 3.4GHz Dual-Core SR1NP CPU Processor,correct item work fine thank,correct item work fine thank,"May, 2024",wjzhx,5 out of 5 stars,https://www.ebay.com/urw/Intel-Core-i3-4130-3-4GHz-Dual-Core-SR1NP-CPU-Processor/product-reviews/20066941741
Intel Core i3-4130 3.4GHz Dual-Core SR1NP CPU Processor,work great thanks,work great thanks,"Jun, 2024",oldsman34,5 out of 5 stars,https://www.ebay.com/urw/Intel-Core-i3-4130-3-4GHz-Dual-Core-SR1NP-CPU-Processor/product-reviews/20066941741
Intel Core i3-4130 3.4GHz Dual-Core SR1NP CPU Processor,came fast work great,came fast work great,"Jun, 2024",nudildas,5 out of 5 stars,https://www.ebay.com/urw/Intel-Core-i3-4130-3-4GHz-Dual-Core-SR1NP-CPU-Processor/product-reviews/20066941741
Intel Core i3-4130 3.4GHz Dual-Core SR1NP CPU Processor,clean well functional,clean well functional,"May, 2024",slid0124-a8g2pz...,5 out of 5 stars,https://www.ebay.com/urw/Intel-Core-i3-4130-3-4GHz-Dual-Core-SR1NP-CPU-Processor/product-reviews/20066941741
Intel Core i3-4130 3.4GHz Dual-Core SR1NP CPU Processor,work perfect,work perfect,"May, 2024",chapol25,5 out of 5 stars,https://www.ebay.com/urw/Intel-Core-i3-4130-3-4GHz-Dual-Core-SR1NP-CPU-Processor/product-reviews/20066941741
Intel Core i3-4130 3.4GHz Dual-Core SR1NP CPU Processor,work perfectly thank,work perfectly thank,"Jun, 2024",x44plus,5 out of 5 stars,https://www.ebay.com/urw/Intel-Core-i3-4130-3-4GHz-Dual-Core-SR1NP-CPU-Processor/product-reviews/20066941741
Intel Core i3-4130 3.4GHz Dual-Core SR1NP CPU Processor,excellent quality price,excellent quality price,"May, 2024",isgz-0,5 out of 5 stars,https://www.ebay.com/urw/Intel-Core-i3-4130-3-4GHz-Dual-Core-SR1NP-CPU-Processor/product-reviews/20066941741
Intel Core I7-6950X 3.50 GHz 10 Core (BX80671I76950X) Processor,got payed,great procccesor say worth money got iti tested game tell right anyone saying processor good single threaded performance know talking hand completely demolished certain benchmark ran certain game compared along kthe beat couple game title nothimg would notice gameplay getting hold single threaded performance low utilization core count certain gamesso game would way enouph satisfy need also say alot game streaming newely released ryzen way kust two centsnow working use wrong extremely fast file encryption multitasking name extremely fast importanly without error get money worth bottom linein conclusion would highly recomend processor anybody money buy itread full review,"Apr, 2017",5QqM3NT5Spe@Del...,5 out of 5 stars,https://www.ebay.com/urw/Intel-Core-I7-6950X-3-50-GHz-10-Core-BX80671I76950X-Processor/product-reviews/11019365082
Intel Core I7-6950X 3.50 GHz 10 Core (BX80671I76950X) Processor,great value current pricing,managed get nice ghz overclock quiet tdp air cooler running volt feel like gotten good chip make huge boost productivity great gaming total war shogun ultra wgtx tiother practical video rendering gaming streaming feel nice extreme edition cpu bragging right around buddy,"Nov, 2017",felix.pisco,5 out of 5 stars,https://www.ebay.com/urw/Intel-Core-I7-6950X-3-50-GHz-10-Core-BX80671I76950X-Processor/product-reviews/11019365082
Intel Core I7-6950X 3.50 GHz 10 Core (BX80671I76950X) Processor,intel cpu,installation cpu existing computer took hour included cleanup system bios adjustment cpu performed better excellent native speed ghz overclock never regret purchase,"Mar, 2018",kenkenny001,5 out of 5 stars,https://www.ebay.com/urw/Intel-Core-I7-6950X-3-50-GHz-10-Core-BX80671I76950X-Processor/product-reviews/11019365082
Intel Core I7-6950X 3.50 GHz 10 Core (BX80671I76950X) Processor,another awesome intel product,awesome year old product brand new item old tech run ddr ram quad channel worked great since day one overclocked ghz running around normal usage load running volt cpu seen run guess good luck draw still fast processor able run current software hardwaremy buildthermaltake view rgbrog rampage extreme xintel overclocked ghzgskill trident mhz gig ram tfcqgtz running quad channel modecorsair pro fan front fan back radiator pushpull setupdual msi tiscooler master watt psuwd pcie nvme tbread full review,"Jun, 2020",drexel6454,5 out of 5 stars,https://www.ebay.com/urw/Intel-Core-I7-6950X-3-50-GHz-10-Core-BX80671I76950X-Processor/product-reviews/11019365082
Intel Core I7-6950X 3.50 GHz 10 Core (BX80671I76950X) Processor,great chip aware recent microcode update disabled overclocking tinkering system folder necessary,got mine stable ghz notice boost barely stable running ghz still powerful chip like said title recent microcode update window broken overclocking simple fix entail renaming file called mcupdategenuineintelldll taking ownership google,"Sep, 2020",g-jger-e0a1j6gwud,5 out of 5 stars,https://www.ebay.com/urw/Intel-Core-I7-6950X-3-50-GHz-10-Core-BX80671I76950X-Processor/product-reviews/11019365082
Intel Core I7-6950X 3.50 GHz 10 Core (BX80671I76950X) Processor,workhorse,find one good price platform still extremely viable high end desktop solution overclocked ghz core thread capable handling modern task run rtx virtually bottleneck recommend serious cooling solution,"Nov, 2019",goumodra,5 out of 5 stars,https://www.ebay.com/urw/Intel-Core-I7-6950X-3-50-GHz-10-Core-BX80671I76950X-Processor/product-reviews/11019365082
Intel Core I7-6950X 3.50 GHz 10 Core (BX80671I76950X) Processor,fastest chip get boardsbut platform blown,much upgrade expected coming arrived time well packed damage work perfectly,"Dec, 2020",carburdic-8,4 out of 5 stars,https://www.ebay.com/urw/Intel-Core-I7-6950X-3-50-GHz-10-Core-BX80671I76950X-Processor/product-reviews/11019365082
Intel Core I7-6950X 3.50 GHz 10 Core (BX80671I76950X) Processor,core monster intel,beast cpu overclocked ghz since powerful need push higher although feel chip push really core needed rather cpu run cool since intend lot video editing work beast,"Aug, 2017",kashifgul,5 out of 5 stars,https://www.ebay.com/urw/Intel-Core-I7-6950X-3-50-GHz-10-Core-BX80671I76950X-Processor/product-reviews/11019365082
Intel Core I7-6950X 3.50 GHz 10 Core (BX80671I76950X) Processor,finally got cpu wanting age,got exactly wanted work like charm much else say,"Jun, 2020",danloug_47,5 out of 5 stars,https://www.ebay.com/urw/Intel-Core-I7-6950X-3-50-GHz-10-Core-BX80671I76950X-Processor/product-reviews/11019365082
Intel Core I7-6950X 3.50 GHz 10 Core (BX80671I76950X) Processor,intel purchase,new original box wrapper fairly bid countered accepted shipped quickly,"Jun, 2020",blazer1023jerry,5 out of 5 stars,https://www.ebay.com/urw/Intel-Core-I7-6950X-3-50-GHz-10-Core-BX80671I76950X-Processor/product-reviews/11019365082
Intel Core I7-6950X 3.50 GHz 10 Core (BX80671I76950X) Processor,excellent bang buck system,upgraded cpu happy performance increase,"Nov, 2019",the4man,5 out of 5 stars,https://www.ebay.com/urw/Intel-Core-I7-6950X-3-50-GHz-10-Core-BX80671I76950X-Processor/product-reviews/11019365082?pgn=2
Intel Core I7-6950X 3.50 GHz 10 Core (BX80671I76950X) Processor,work great,work great updated core one thanks lot,"Dec, 2020",masalva64,5 out of 5 stars,https://www.ebay.com/urw/Intel-Core-I7-6950X-3-50-GHz-10-Core-BX80671I76950X-Processor/product-reviews/11019365082?pgn=2
Intel Core I7-6950X 3.50 GHz 10 Core (BX80671I76950X) Processor,intel extreme edition processor,exactly described replaced burntout processor perfectly,"Dec, 2022",albmald_2306,5 out of 5 stars,https://www.ebay.com/urw/Intel-Core-I7-6950X-3-50-GHz-10-Core-BX80671I76950X-Processor/product-reviews/11019365082?pgn=2
Intel Core I7-6950X 3.50 GHz 10 Core (BX80671I76950X) Processor,powerful cool,ghz volt beat,"Apr, 2018",jk0645-bvx764koms,5 out of 5 stars,https://www.ebay.com/urw/Intel-Core-I7-6950X-3-50-GHz-10-Core-BX80671I76950X-Processor/product-reviews/11019365082?pgn=2
Intel Core I7-6950X 3.50 GHz 10 Core (BX80671I76950X) Processor,core beast,probably best consumer chip platform,"Aug, 2018",alesherma-18,5 out of 5 stars,https://www.ebay.com/urw/Intel-Core-I7-6950X-3-50-GHz-10-Core-BX80671I76950X-Processor/product-reviews/11019365082?pgn=2
Intel Core I7-6950X 3.50 GHz 10 Core (BX80671I76950X) Processor,powerrr,handle anything give ease,"Jun, 2021",blackwid0wxr7,5 out of 5 stars,https://www.ebay.com/urw/Intel-Core-I7-6950X-3-50-GHz-10-Core-BX80671I76950X-Processor/product-reviews/11019365082?pgn=2
Intel Core I7-6950X 3.50 GHz 10 Core (BX80671I76950X) Processor,said,work well issue kid nice responded often,"Jan, 2021",greenacid_jason...,5 out of 5 stars,https://www.ebay.com/urw/Intel-Core-I7-6950X-3-50-GHz-10-Core-BX80671I76950X-Processor/product-reviews/11019365082?pgn=2
Intel Core i7 3632QM 2.2GHz Quad-Core (AW8063801152800) Processor,overall cpu work expected,much review replaced lower performing cpu lenovo laptop one performs expected although one issue came aware longer enough charger laptop work requred one despite cpu tdp chose cpu intentionally cooled existing cooling solution still power consumption expected lenovo higher charger laptop work either battery charging sleep work also purely charger removed battery,"Mar, 2024",martveid77,5 out of 5 stars,https://www.ebay.com/urw/Intel-Core-i7-3632QM-2-2GHz-Quad-Core-AW8063801152800-Processor/product-reviews/219436141
Intel Core i7 3632QM 2.2GHz Quad-Core (AW8063801152800) Processor,noticeably faster,intel core srv mobile cpu processor quad core noticeably faster intel core dual core cpu replaced think reason core turbo boost technology core,"Jun, 2017",jgre4353,3 out of 5 stars,https://www.ebay.com/urw/Intel-Core-i7-3632QM-2-2GHz-Quad-Core-AW8063801152800-Processor/product-reviews/219436141
Intel Core i7 3632QM 2.2GHz Quad-Core (AW8063801152800) Processor,cheap upgrade old laptop,performance expect gen core cpu fit laptop limited cooling capacity definitely worth upgrading core solution use thinkpad heating previous cpu issue,"Feb, 2021",rendszerhangszoro,5 out of 5 stars,https://www.ebay.com/urw/Intel-Core-i7-3632QM-2-2GHz-Quad-Core-AW8063801152800-Processor/product-reviews/219436141
Intel Core i7 3632QM 2.2GHz Quad-Core (AW8063801152800) Processor,still power cpu almost like still good quadcore cpu multitasking,good cpu upgraded core core laptop twice power still good cpu work good video multiple program chrome tab also work good think cpu still used year upgrade worth slow browsing chomes tab,"Jul, 2020",nrj777,5 out of 5 stars,https://www.ebay.com/urw/Intel-Core-i7-3632QM-2-2GHz-Quad-Core-AW8063801152800-Processor/product-reviews/219436141
Intel Core i7 3632QM 2.2GHz Quad-Core (AW8063801152800) Processor,install,installed run fine tdp watt degree hotter also upgraded cooler dual heat sink pipe delta fan,"Aug, 2020",bushm49,4 out of 5 stars,https://www.ebay.com/urw/Intel-Core-i7-3632QM-2-2GHz-Quad-Core-AW8063801152800-Processor/product-reviews/219436141
Intel Core i7 3632QM 2.2GHz Quad-Core (AW8063801152800) Processor,fast cheap easy,fast easy quad core processor upgraded could happier,"Aug, 2020",garth285,5 out of 5 stars,https://www.ebay.com/urw/Intel-Core-i7-3632QM-2-2GHz-Quad-Core-AW8063801152800-Processor/product-reviews/219436141
Intel Core i7 3632QM 2.2GHz Quad-Core (AW8063801152800) Processor,great deal,product good described,"Feb, 2021",dyzemarlon,5 out of 5 stars,https://www.ebay.com/urw/Intel-Core-i7-3632QM-2-2GHz-Quad-Core-AW8063801152800-Processor/product-reviews/219436141
Intel Core i7 3632QM 2.2GHz Quad-Core (AW8063801152800) Processor,perfect replacement performance required,replaced dell lattitude software configuration needed booted like nothing changed except noticeably snappier bench roughly single core faster quadcore faster multicore graphic performance watt old processor run hotter detected difference battery noticeable running virtual machine pleased,"Mar, 2018",fazerdude,5 out of 5 stars,https://www.ebay.com/urw/Intel-Core-i7-3632QM-2-2GHz-Quad-Core-AW8063801152800-Processor/product-reviews/219436141
Intel Core i7 3632QM 2.2GHz Quad-Core (AW8063801152800) Processor,amazing,arrived fast wrapped super safe box work perfectly,"Jul, 2020",metax.gr2014,5 out of 5 stars,https://www.ebay.com/urw/Intel-Core-i7-3632QM-2-2GHz-Quad-Core-AW8063801152800-Processor/product-reviews/219436141
Intel Core i7 3632QM 2.2GHz Quad-Core (AW8063801152800) Processor,fast low overheat,working properly sometimes overheats considerably faster previous cpu,"Jun, 2021",vasga-9512,5 out of 5 stars,https://www.ebay.com/urw/Intel-Core-i7-3632QM-2-2GHz-Quad-Core-AW8063801152800-Processor/product-reviews/219436141
Intel Core i7 3632QM 2.2GHz Quad-Core (AW8063801152800) Processor,awesome,work super well daughter computer installed teenager,"Apr, 2020",rir4386-cx3gkybwji,5 out of 5 stars,https://www.ebay.com/urw/Intel-Core-i7-3632QM-2-2GHz-Quad-Core-AW8063801152800-Processor/product-reviews/219436141?pgn=2
Intel Core i7 3632QM 2.2GHz Quad-Core (AW8063801152800) Processor,great cpu,upgrade old laptop cpu run fast,"Nov, 2020",michelholm1975,5 out of 5 stars,https://www.ebay.com/urw/Intel-Core-i7-3632QM-2-2GHz-Quad-Core-AW8063801152800-Processor/product-reviews/219436141?pgn=2
Intel Core i7 3632QM 2.2GHz Quad-Core (AW8063801152800) Processor,,fast cpu get hotter dell although also tdp,"Jul, 2021",kkotidis,4 out of 5 stars,https://www.ebay.com/urw/Intel-Core-i7-3632QM-2-2GHz-Quad-Core-AW8063801152800-Processor/product-reviews/219436141?pgn=2
Intel Core i7 3632QM 2.2GHz Quad-Core (AW8063801152800) Processor,perfect,bought upgrade great improvement,"Jan, 2022",willy1k5,5 out of 5 stars,https://www.ebay.com/urw/Intel-Core-i7-3632QM-2-2GHz-Quad-Core-AW8063801152800-Processor/product-reviews/219436141?pgn=2
Intel Core i7 3632QM 2.2GHz Quad-Core (AW8063801152800) Processor,perfect,product received perfect condiotion good price,"Mar, 2016",martijnwolbrink,5 out of 5 stars,https://www.ebay.com/urw/Intel-Core-i7-3632QM-2-2GHz-Quad-Core-AW8063801152800-Processor/product-reviews/219436141?pgn=2
